<bookstore xmlns:xsi="http://www.w3.org/2001/XMLSchema-instance"
           xsi:noNamespaceSchemaLocation="input.xsd">

    <book id="1">
        <genre>Fantasy</genre>
        <author>Sarah J Maas</author>
        <title>House of Earth and Blood</title>
        <year>2020</year>
        <series>Crescent City</series>
        <price currency="UAH">150.00</price>
    </book>
    <book id="2">
        <genre>Fantasy</genre>
        <author>Carol Goodman</author>
        <title>The Demon Lover</title>
        <year>2011</year>
        <series>Fairwick Chronicles</series>
        <price currency="USD">11.0</price>
    </book>
    <book id="3">
        <genre>Fantasy</genre>
        <author>Carol Goodman</author>
        <title>The Water Witch</title>
        <year>2013</year>
        <series>Fairwick Chronicle</series>
        <price currency="USD">10.0</price>
    </book>
    <book id="4">
        <genre>Fantasy</genre>
        <author>Carol Goodman</author>
        <title>The Angel Stone</title>
        <year>2013</year>
        <series>Fairwick Chronicles</series>
        <price currency="USD">12.0</price>
    </book>
    <book id="5">
        <genre>Mystery</genre>
        <author>Carol Goodman</author>
        <title>The Night Villa</title>
        <year>2008</year>
        <price currency="USD">11.0</price>
    </book>
</bookstore>